<?xml version="1.0" encoding="UTF-8"?>
<!DOCTYPE topology SYSTEM "hwloc2.dtd">
<topology version="2.0">
  <object type="Machine" os_index="0" cpuset="0x000f000f" complete_cpuset="0x00ff00ff" allowed_cpuset="0x000f000f" nodeset="0x00010005" complete_nodeset="0x00010005" allowed_nodeset="0x00010005" gp_index="1">
    <info name="Backend" value="Linux"/>
    <info name="Architecture" value="ia64"/>
    <info name="hwlocVersion" value="1.11.8"/>
    <info name="ProcessName" value="lstopo"/>
    <object type="Group" cpuset="0x0000000f" complete_cpuset="0x0000000f" nodeset="0x00000001" complete_nodeset="0x00000001" gp_index="28" kind="1001" subkind="0">
      <object type="NUMANode" os_index="0" cpuset="0x0000000f" complete_cpuset="0x0000000f" nodeset="0x00000001" complete_nodeset="0x00000001" gp_index="2" local_memory="102458458112"/>
      <object type="Package" os_index="0" cpuset="0x00000003" complete_cpuset="0x00000003" nodeset="0x00000001" complete_nodeset="0x00000001" gp_index="4">
        <info name="CPUVendor" value="GenuineIntel"/>
        <info name="CPUFamilyNumber" value="32"/>
        <info name="CPUModelNumber" value="1"/>
        <info name="CPUModel" value="Dual-Core Intel(R) Itanium(R) Processor 9140N"/>
        <object type="Core" os_index="0" cpuset="0x00000001" complete_cpuset="0x00000001" nodeset="0x00000001" complete_nodeset="0x00000001" gp_index="5">
          <object type="PU" os_index="0" cpuset="0x00000001" complete_cpuset="0x00000001" nodeset="0x00000001" complete_nodeset="0x00000001" gp_index="6"/>
        </object>
        <object type="Core" os_index="1" cpuset="0x00000002" complete_cpuset="0x00000002" nodeset="0x00000001" complete_nodeset="0x00000001" gp_index="7">
          <object type="PU" os_index="1" cpuset="0x00000002" complete_cpuset="0x00000002" nodeset="0x00000001" complete_nodeset="0x00000001" gp_index="8"/>
        </object>
      </object>
      <object type="Package" os_index="1" cpuset="0x0000000c" complete_cpuset="0x0000000c" nodeset="0x00000001" complete_nodeset="0x00000001" gp_index="9">
        <info name="CPUVendor" value="GenuineIntel"/>
        <info name="CPUFamilyNumber" value="32"/>
        <info name="CPUModelNumber" value="1"/>
        <info name="CPUModel" value="Dual-Core Intel(R) Itanium(R) Processor 9140N"/>
        <object type="Core" os_index="0" cpuset="0x00000004" complete_cpuset="0x00000004" nodeset="0x00000001" complete_nodeset="0x00000001" gp_index="10">
          <object type="PU" os_index="2" cpuset="0x00000004" complete_cpuset="0x00000004" nodeset="0x00000001" complete_nodeset="0x00000001" gp_index="11"/>
        </object>
        <object type="Core" os_index="1" cpuset="0x00000008" complete_cpuset="0x00000008" nodeset="0x00000001" complete_nodeset="0x00000001" gp_index="12">
          <object type="PU" os_index="3" cpuset="0x00000008" complete_cpuset="0x00000008" nodeset="0x00000001" complete_nodeset="0x00000001" gp_index="13"/>
        </object>
      </object>
    </object>
    <object type="Group" cpuset="0x000f0000" complete_cpuset="0x000f0000" nodeset="0x00000004" complete_nodeset="0x00000004" gp_index="29" kind="1001" subkind="0">
      <object type="NUMANode" os_index="2" cpuset="0x000f0000" complete_cpuset="0x000f0000" nodeset="0x00000004" complete_nodeset="0x00000004" gp_index="14" local_memory="103012106240"/>
      <object type="Package" os_index="131072" cpuset="0x00030000" complete_cpuset="0x00030000" nodeset="0x00000004" complete_nodeset="0x00000004" gp_index="16">
        <info name="CPUVendor" value="GenuineIntel"/>
        <info name="CPUFamilyNumber" value="32"/>
        <info name="CPUModelNumber" value="1"/>
        <info name="CPUModel" value="Dual-Core Intel(R) Itanium(R) Processor 9140N"/>
        <object type="Core" os_index="0" cpuset="0x00010000" complete_cpuset="0x00010000" nodeset="0x00000004" complete_nodeset="0x00000004" gp_index="17">
          <object type="PU" os_index="16" cpuset="0x00010000" complete_cpuset="0x00010000" nodeset="0x00000004" complete_nodeset="0x00000004" gp_index="18"/>
        </object>
        <object type="Core" os_index="1" cpuset="0x00020000" complete_cpuset="0x00020000" nodeset="0x00000004" complete_nodeset="0x00000004" gp_index="19">
          <object type="PU" os_index="17" cpuset="0x00020000" complete_cpuset="0x00020000" nodeset="0x00000004" complete_nodeset="0x00000004" gp_index="20"/>
        </object>
      </object>
      <object type="Package" os_index="131073" cpuset="0x000c0000" complete_cpuset="0x000c0000" nodeset="0x00000004" complete_nodeset="0x00000004" gp_index="21">
        <info name="CPUVendor" value="GenuineIntel"/>
        <info name="CPUFamilyNumber" value="32"/>
        <info name="CPUModelNumber" value="1"/>
        <info name="CPUModel" value="Dual-Core Intel(R) Itanium(R) Processor 9140N"/>
        <object type="Core" os_index="0" cpuset="0x00040000" complete_cpuset="0x00040000" nodeset="0x00000004" complete_nodeset="0x00000004" gp_index="22">
          <object type="PU" os_index="18" cpuset="0x00040000" complete_cpuset="0x00040000" nodeset="0x00000004" complete_nodeset="0x00000004" gp_index="23"/>
        </object>
        <object type="Core" os_index="1" cpuset="0x00080000" complete_cpuset="0x00080000" nodeset="0x00000004" complete_nodeset="0x00000004" gp_index="24">
          <object type="PU" os_index="19" cpuset="0x00080000" complete_cpuset="0x00080000" nodeset="0x00000004" complete_nodeset="0x00000004" gp_index="25"/>
        </object>
      </object>
    </object>
    <object type="Group" cpuset="0x0" complete_cpuset="0x0" nodeset="0x00010000" complete_nodeset="0x00010000" gp_index="30" kind="1001" subkind="0">
      <object type="NUMANode" os_index="16" cpuset="0x0" complete_cpuset="0x0" nodeset="0x00010000" complete_nodeset="0x00010000" gp_index="26" local_memory="1044660224"/>
    </object>
  </object>
  <distances2 type="NUMANode" nbobjs="3" kind="5" indexing="os">
    <indexes length="7">0 2 16 </indexes>
    <u64values length="27">10 17 17 17 17 10 14 14 14 </u64values>
  </distances2>
</topology>
