<?xml version="1.0" encoding="UTF-8"?>
<!DOCTYPE topology SYSTEM "hwloc2.dtd">
<topology version="2.0">
  <object type="Machine" cpuset="0x00000003" complete_cpuset="0x00000003" allowed_cpuset="0x00000003" nodeset="0x00000001" complete_nodeset="0x00000001" allowed_nodeset="0x00000001" gp_index="2">
    <info name="hwlocVersion" value="v1.11-20170902.0906.git16cb39b"/>
    <info name="ProcessName" value="lstopo-no-graphics"/>
    <object type="NUMANode" os_index="0" cpuset="0x00000003" complete_cpuset="0x00000003" nodeset="0x00000001" complete_nodeset="0x00000001" gp_index="1" local_memory="2147074048">
      <page_type size="4096" count="0"/>
      <info name="hwlocVersion" value="v1.11-20170902.0906.git16cb39b"/>
      <info name="ProcessName" value="lstopo-no-graphics"/>
    </object>
    <object type="Package" os_index="0" cpuset="0x00000001" complete_cpuset="0x00000001" nodeset="0x00000001" complete_nodeset="0x00000001" gp_index="3">
      <info name="CPUModel" value="QEMU Virtual CPU version (cpu64-rhel6)"/>
      <info name="CPUVendor" value="GenuineIntel"/>
      <info name="CPUFamilyNumber" value="6"/>
      <info name="CPUModelNumber" value="13"/>
      <info name="CPUStepping" value="3"/>
      <object type="L2Cache" os_index="0" cpuset="0x00000001" complete_cpuset="0x00000001" nodeset="0x00000001" complete_nodeset="0x00000001" gp_index="4" cache_size="4194304" depth="2" cache_linesize="64" cache_associativity="16" cache_type="0">
        <info name="Inclusive" value="0"/>
        <object type="L1Cache" os_index="0" cpuset="0x00000001" complete_cpuset="0x00000001" nodeset="0x00000001" complete_nodeset="0x00000001" gp_index="5" cache_size="32768" depth="1" cache_linesize="64" cache_associativity="8" cache_type="1">
          <info name="Inclusive" value="0"/>
          <object type="L1iCache" os_index="0" cpuset="0x00000001" complete_cpuset="0x00000001" nodeset="0x00000001" complete_nodeset="0x00000001" gp_index="6" cache_size="32768" depth="1" cache_linesize="64" cache_associativity="8" cache_type="2">
            <info name="Inclusive" value="0"/>
            <object type="Core" os_index="0" cpuset="0x00000001" complete_cpuset="0x00000001" nodeset="0x00000001" complete_nodeset="0x00000001" gp_index="7">
              <object type="PU" os_index="0" cpuset="0x00000001" complete_cpuset="0x00000001" nodeset="0x00000001" complete_nodeset="0x00000001" gp_index="8"/>
            </object>
          </object>
        </object>
      </object>
    </object>
    <object type="Package" os_index="1" cpuset="0x00000002" complete_cpuset="0x00000002" nodeset="0x00000001" complete_nodeset="0x00000001" gp_index="9">
      <info name="CPUModel" value="QEMU Virtual CPU version (cpu64-rhel6)"/>
      <info name="CPUVendor" value="GenuineIntel"/>
      <info name="CPUFamilyNumber" value="6"/>
      <info name="CPUModelNumber" value="13"/>
      <info name="CPUStepping" value="3"/>
      <object type="L2Cache" os_index="1" cpuset="0x00000002" complete_cpuset="0x00000002" nodeset="0x00000001" complete_nodeset="0x00000001" gp_index="10" cache_size="4194304" depth="2" cache_linesize="64" cache_associativity="16" cache_type="0">
        <info name="Inclusive" value="0"/>
        <object type="L1Cache" os_index="1" cpuset="0x00000002" complete_cpuset="0x00000002" nodeset="0x00000001" complete_nodeset="0x00000001" gp_index="11" cache_size="32768" depth="1" cache_linesize="64" cache_associativity="8" cache_type="1">
          <info name="Inclusive" value="0"/>
          <object type="L1iCache" os_index="1" cpuset="0x00000002" complete_cpuset="0x00000002" nodeset="0x00000001" complete_nodeset="0x00000001" gp_index="12" cache_size="32768" depth="1" cache_linesize="64" cache_associativity="8" cache_type="2">
            <info name="Inclusive" value="0"/>
            <object type="Core" os_index="1" cpuset="0x00000002" complete_cpuset="0x00000002" nodeset="0x00000001" complete_nodeset="0x00000001" gp_index="13">
              <object type="PU" os_index="1" cpuset="0x00000002" complete_cpuset="0x00000002" nodeset="0x00000001" complete_nodeset="0x00000001" gp_index="14"/>
            </object>
          </object>
        </object>
      </object>
    </object>
  </object>
</topology>
